ID,Display Name,Category,Sub-Category,Primary Link,Secondary Link,Author Name,Author Link,Active,Last Modified,Last Checked,License,Description
cmd-2981aaf0,/do-issue,Slash-Commands,Project & Task Management,https://github.com/jerseycheese/Narraitor/blob/feature/issue-227-ai-suggestions/.claude/commands/do-issue.md,,jerseycheese,https://github.com/jerseycheese,FALSE,,2025-07-18:02-04-13,MIT,"Implements GitHub issues with manual review points, following a structured approach with issue number parameter and offering alternative automated mode for efficiency."
cmd-f5425f91,/next-task,Slash-Commands,Project & Task Management,https://github.com/wmjones/wyatt-personal-aws/blob/main/.claude/commands/next-task.md,,wmjones,https://github.com/wmjones,FALSE,,2025-07-18:02-04-14,NOT_FOUND,"Gets the next task from TaskMaster and creates a branch for it, integrating with task management systems, automating branch creation, and enforcing naming conventions."
cmd-80018864,/project_hello_w_name,Slash-Commands,Project & Task Management,https://github.com/disler/just-prompt/blob/main/.claude/commands/project_hello_w_name.md,,disler,https://github.com/disler,TRUE,2025-03-21:15-24-08,2025-07-18:02-04-14,NOT_FOUND,"Creates customizable greeting components with name input, demonstrating argument passing, component reusability, state management, and user input handling."
cmd-1bc55517,/todo,Slash-Commands,Project & Task Management,https://github.com/chrisleyva/todo-slash-command/blob/main/todo.md,,chrisleyva,https://github.com/chrisleyva,TRUE,2025-06-25:23-12-22,2025-07-18:02-04-15,MIT,"A convenient command to quickly manage project todo items without leaving the Claude Code interface, featuring due dates, sorting, task prioritization, and comprehensive todo list management."
cmd-9d234db1,/analyze-issue,Slash-Commands,Version Control & Git,https://github.com/jerseycheese/Narraitor/blob/feature/issue-227-ai-suggestions/.claude/commands/analyze-issue.md,,jerseycheese,https://github.com/jerseycheese,FALSE,,2025-07-18:02-04-15,MIT,"Fetches GitHub issue details to create comprehensive implementation specifications, analyzing requirements and planning structured approach with clear implementation steps."
cmd-4a72b306,/bug-fix,Slash-Commands,Version Control & Git,https://github.com/danielscholl/mvn-mcp-server/blob/main/.claude/commands/bug-fix.md,,danielscholl,https://github.com/danielscholl,TRUE,2025-05-06:23-07-03,2025-07-18:02-04-16,NOT_FOUND,"Streamlines bug fixing by creating a GitHub issue first, then a feature branch for implementing and thoroughly testing the solution before merging."
cmd-b6a797df,/commit,Slash-Commands,Version Control & Git,https://github.com/evmts/tevm-monorepo/blob/main/.claude/commands/commit.md,,evmts,https://github.com/evmts,TRUE,2025-03-25:09-20-57,2025-07-18:02-04-17,MIT,"Creates git commits using conventional commit format with appropriate emojis, following project standards and creating descriptive messages that explain the purpose of changes."
cmd-6aeeadd6,/commit-fast,Slash-Commands,Version Control & Git,https://github.com/steadycursor/steadystart/blob/main/.claude/commands/2-commit-fast.md,,steadycursor,https://github.com/steadycursor,TRUE,2025-04-04:20-37-25,2025-07-18:02-04-18,NOT_FOUND,"Automates git commit process by selecting the first suggested message, generating structured commits with consistent formatting while skipping manual confirmation and removing Claude co-Contributorship footer"
cmd-2f41bf88,/create-pr,Slash-Commands,Version Control & Git,https://github.com/toyamarinyon/giselle/blob/main/.claude/commands/create-pr.md,,toyamarinyon,https://github.com/toyamarinyon,TRUE,2025-04-04:03-22-03,2025-07-18:02-04-18,Apache-2.0,"Streamlines pull request creation by handling the entire workflow: creating a new branch, committing changes, formatting modified files with Biome, and submitting the PR."
cmd-6f066b19,/create-pull-request,Slash-Commands,Version Control & Git,https://github.com/liam-hq/liam/blob/main/.claude/commands/create-pull-request.md,,liam-hq,https://github.com/liam-hq,TRUE,2025-07-11:08-28-12,2025-07-18:02-04-19,Apache-2.0,"Provides comprehensive PR creation guidance with GitHub CLI, enforcing title conventions, following template structure, and offering concrete command examples with best practices."
cmd-54c60a04,/create-worktrees,Slash-Commands,Version Control & Git,https://github.com/evmts/tevm-monorepo/blob/main/.claude/commands/create-worktrees.md,,evmts,https://github.com/evmts,TRUE,2025-03-14:02-00-50,2025-07-18:02-04-20,MIT,"Creates git worktrees for all open PRs or specific branches, handling branches with slashes, cleaning up stale worktrees, and supporting custom branch creation for development."
cmd-d39b623d,/fix-github-issue,Slash-Commands,Version Control & Git,https://github.com/jeremymailen/kotlinter-gradle/blob/master/.claude/commands/fix-github-issue.md,,jeremymailen,https://github.com/jeremymailen,TRUE,2025-04-24:05-58-40,2025-07-18:02-04-21,Apache-2.0,"Analyzes and fixes GitHub issues using a structured approach with GitHub CLI for issue details, implementing necessary code changes, running tests, and creating proper commit messages."
cmd-85f39721,/fix-issue,Slash-Commands,Version Control & Git,https://github.com/metabase/metabase/blob/master/.claude/commands/fix-issue.md,,metabase,https://github.com/metabase,TRUE,2025-04-08:08-37-04,2025-07-18:02-04-22,NOASSERTION,"Addresses GitHub issues by taking issue number as parameter, analyzing context, implementing solution, and testing/validating the fix for proper integration."
cmd-16c71a8c,/fix-pr,Slash-Commands,Version Control & Git,https://github.com/metabase/metabase/blob/master/.claude/commands/fix-pr.md,,metabase,https://github.com/metabase,TRUE,2025-04-08:08-37-04,2025-07-18:02-04-23,NOASSERTION,"Fetches and fixes unresolved PR comments by automatically retrieving feedback, addressing reviewer concerns, making targeted code improvements, and streamlining the review process."
cmd-a1042630,/husky,Slash-Commands,Version Control & Git,https://github.com/evmts/tevm-monorepo/blob/main/.claude/commands/husky.md,,evmts,https://github.com/evmts,TRUE,2025-03-07:19-38-27,2025-07-18:02-04-23,MIT,"Sets up and manages Husky Git hooks by configuring pre-commit hooks, establishing commit message standards, integrating with linting tools, and ensuring code quality on commits."
cmd-7f51ad4d,/pr-review,Slash-Commands,Version Control & Git,https://github.com/arkavo-org/opentdf-rs/blob/main/.claude/commands/pr-review.md,,arkavo-org,https://github.com/arkavo-org,TRUE,2025-04-03:01-10-13,2025-07-18:02-04-24,MIT,"Reviews pull request changes to provide feedback, check for issues, and suggest improvements before merging into the main codebase."
cmd-d32f827c,/update-branch-name,Slash-Commands,Version Control & Git,https://github.com/giselles-ai/giselle/blob/main/.claude/commands/update-branch-name.md,,giselles-ai,https://github.com/giselles-ai,TRUE,2025-04-16:04-08-41,2025-07-18:02-04-25,Apache-2.0,"Updates branch names with proper prefixes and formats, enforcing naming conventions, supporting semantic prefixes, and managing remote branch updates."
claude-6348c9dd,AVS Vibe Developer Guide,CLAUDE.md Files,Domain-Specific,https://github.com/Layr-Labs/avs-vibe-developer-guide/blob/master/CLAUDE.md,,Layr-Labs,https://github.com/Layr-Labs,TRUE,2025-04-09:18-03-54,2025-07-18:02-04-26,MIT,Structures AI-assisted EigenLayer AVS development workflow with consistent naming conventions for prompt files and established terminology standards for blockchain concepts.
claude-d8f940fa,Comm,CLAUDE.md Files,Domain-Specific,https://github.com/CommE2E/comm/blob/master/CLAUDE.md,,CommE2E,https://github.com/CommE2E,TRUE,2025-03-21:02-22-09,2025-07-18:02-04-26,BSD-3-Clause,"Serves as a development reference for E2E-encrypted messaging applications with code organization architecture, security implementation details, and testing procedures."
claude-d0e5c826,Course Builder,CLAUDE.md Files,Domain-Specific,https://github.com/badass-courses/course-builder/blob/main/CLAUDE.md,,badass-courses,https://github.com/badass-courses,TRUE,2025-03-18:02-42-14,2025-07-18:02-04-27,MIT,Enables real-time multiplayer capabilities for collaborative course creation with diverse tech stack integration and monorepo architecture using Turborepo.
claude-3b207e6e,Cursor Tools,CLAUDE.md Files,Domain-Specific,https://github.com/eastlondoner/cursor-tools/blob/main/CLAUDE.md,,eastlondoner,https://github.com/eastlondoner,TRUE,2025-04-26:20-26-53,2025-07-18:02-04-28,MIT,"Creates a versatile AI command interface supporting multiple providers and models with flexible command options and browser automation through ""Stagehand"" feature."
claude-0ce42e78,Guitar,CLAUDE.md Files,Domain-Specific,https://github.com/soramimi/Guitar/blob/master/CLAUDE.md,,soramimi,https://github.com/soramimi,TRUE,2025-03-28:11-01-30,2025-07-18:02-04-29,GPL-2.0,"Serves as development guide for Guitar Git GUI Client with build commands for various platforms, code style guidelines for contributing, and project structure explanation."
claude-4a956e32,Network Chronicles,CLAUDE.md Files,Domain-Specific,https://github.com/Fimeg/NetworkChronicles/blob/legacy-v1/CLAUDE.md,,Fimeg,https://github.com/Fimeg,TRUE,,2025-07-18:02-04-30,MIT,"Presents detailed implementation plan for AI-driven game characters with technical specifications for LLM integration, character guidelines, and service discovery mechanics."
claude-d97bf254,Note Companion,CLAUDE.md Files,Domain-Specific,https://github.com/different-ai/note-companion/blob/master/CLAUDE.md,,different-ai,https://github.com/different-ai,TRUE,2025-03-11:08-16-20,2025-07-18:02-04-31,MIT,Provides detailed styling isolation techniques for Obsidian plugins using Tailwind with custom prefix to prevent style conflicts and practical troubleshooting steps.
claude-5479b4e8,Pareto Mac,CLAUDE.md Files,Domain-Specific,https://github.com/ParetoSecurity/pareto-mac/blob/main/CLAUDE.md,,ParetoSecurity,https://github.com/ParetoSecurity,TRUE,2025-06-20:14-31-59,2025-07-18:02-04-31,GPL-3.0,"Serves as development guide for Mac security audit tool with build instructions, contribution guidelines, testing procedures, and workflow documentation."
claude-2659fc4a,SteadyStart,CLAUDE.md Files,Domain-Specific,https://github.com/steadycursor/steadystart/blob/main/CLAUDE.md,,steadycursor,https://github.com/steadycursor,TRUE,2025-05-12:14-41-24,2025-07-18:02-04-32,NOT_FOUND,"Clear and direct instructives about style, permissions, Claude's ""role"", communications, and documentation of Claude Code sessions for other team members to stay abreast."
claude-ac32c909,AI IntelliJ Plugin,CLAUDE.md Files,Language-Specific,https://github.com/didalgolab/ai-intellij-plugin/blob/main/CLAUDE.md,,didalgolab,https://github.com/didalgolab,TRUE,2025-03-06:19-12-46,2025-07-18:02-04-33,Apache-2.0,"Provides comprehensive Gradle commands for IntelliJ plugin development with platform-specific coding patterns, detailed package structure guidelines, and clear internationalization standards."
claude-bbaa0c15,AWS MCP Server,CLAUDE.md Files,Language-Specific,https://github.com/alexei-led/aws-mcp-server/blob/main/CLAUDE.md,,alexei-led,https://github.com/alexei-led,TRUE,2025-04-06:11-57-11,2025-07-18:02-04-34,MIT,"Features multiple Python environment setup options with detailed code style guidelines, comprehensive error handling recommendations, and security considerations for AWS CLI interactions."
claude-e130a9c3,DroidconKotlin,CLAUDE.md Files,Language-Specific,https://github.com/touchlab/DroidconKotlin/blob/main/CLAUDE.md,,touchlab,https://github.com/touchlab,TRUE,2025-03-26:03-16-04,2025-07-18:02-04-34,Apache-2.0,Delivers comprehensive Gradle commands for cross-platform Kotlin Multiplatform development with clear module structure and practical guidance for dependency injection.
claude-1279cf13,EDSL,CLAUDE.md Files,Language-Specific,https://github.com/expectedparrot/edsl/blob/main/CLAUDE.md,,expectedparrot,https://github.com/expectedparrot,TRUE,2025-07-11:13-39-20,2025-07-18:02-04-35,MIT,"Offers detailed build and test commands with strict code style enforcement, comprehensive testing requirements, and standardized development workflow using Black and mypy."
claude-3ae444b3,Giselle,CLAUDE.md Files,Language-Specific,https://github.com/giselles-ai/giselle/blob/main/CLAUDE.md,,giselles-ai,https://github.com/giselles-ai,TRUE,2025-05-23:03-56-37,2025-07-18:02-04-36,Apache-2.0,Provides detailed build and test commands using pnpm and Vitest with strict code formatting requirements and comprehensive naming conventions for code consistency.
claude-b302b042,HASH,CLAUDE.md Files,Language-Specific,https://github.com/hashintel/hash/blob/main/CLAUDE.md,,hashintel,https://github.com/hashintel,TRUE,2025-07-01:08-29-46,2025-07-18:02-04-37,NOASSERTION,"Features comprehensive repository structure breakdown with strong emphasis on coding standards, detailed Rust documentation guidelines, and systematic PR review process."
claude-6dc32b06,Inkline,CLAUDE.md Files,Language-Specific,https://github.com/inkline/inkline/blob/main/CLAUDE.md,,inkline,https://github.com/inkline,TRUE,2025-03-03:21-25-46,2025-07-18:02-04-38,NOASSERTION,"Structures development workflow using pnpm with emphasis on TypeScript and Vue 3 Composition API, detailed component creation process, and comprehensive testing recommendations."
claude-1821727a,JSBeeb,CLAUDE.md Files,Language-Specific,https://github.com/mattgodbolt/jsbeeb/blob/main/CLAUDE.md,,mattgodbolt,https://github.com/mattgodbolt,TRUE,2025-07-02:04-46-25,2025-07-18:02-04-38,GPL-3.0,"Provides development guide for JavaScript BBC Micro emulator with build and testing instructions, architecture documentation, and debugging workflows."
claude-3591a3e4,Lamoom Python,CLAUDE.md Files,Language-Specific,https://github.com/LamoomAI/lamoom-python/blob/main/CLAUDE.md,,LamoomAI,https://github.com/LamoomAI,TRUE,2025-03-05:21-42-33,2025-07-18:02-04-39,Apache-2.0,"Serves as reference for production prompt engineering library with load balancing of AI Models, API documentation, and usage patterns with examples."
claude-2a18266c,LangGraphJS,CLAUDE.md Files,Language-Specific,https://github.com/langchain-ai/langgraphjs/blob/main/CLAUDE.md,,langchain-ai,https://github.com/langchain-ai,TRUE,2025-03-10:03-51-26,2025-07-18:02-04-40,MIT,"Offers comprehensive build and test commands with detailed TypeScript style guidelines, layered library architecture, and monorepo structure using yarn workspaces."
claude-38b6b458,Metabase,CLAUDE.md Files,Language-Specific,https://github.com/metabase/metabase/blob/master/CLAUDE.md,,metabase,https://github.com/metabase,TRUE,2025-07-09:23-09-17,2025-07-18:02-04-41,NOASSERTION,"Details workflow for REPL-driven development in Clojure/ClojureScript with emphasis on incremental development, testing, and step-by-step approach for feature implementation."
claude-8ff859d0,SG Cars Trends Backend,CLAUDE.md Files,Language-Specific,https://github.com/sgcarstrends/backend/blob/main/CLAUDE.md,,sgcarstrends,https://github.com/sgcarstrends,TRUE,2025-06-18:04-20-45,2025-07-18:02-04-42,NOT_FOUND,"Provides comprehensive structure for TypeScript monorepo projects with detailed commands for development, testing, deployment, and AWS/Cloudflare integration."
claude-28de7758,SPy,CLAUDE.md Files,Language-Specific,https://github.com/spylang/spy/blob/main/CLAUDE.md,,spylang,https://github.com/spylang,TRUE,2025-03-16:15-20-50,2025-07-18:02-04-43,MIT,"Enforces strict coding conventions with comprehensive testing guidelines, multiple code compilation options, and backend-specific test decorators for targeted filtering."
claude-724817c4,TPL,CLAUDE.md Files,Language-Specific,https://github.com/KarpelesLab/tpl/blob/master/CLAUDE.md,,KarpelesLab,https://github.com/KarpelesLab,TRUE,2025-03-28:07-35-50,2025-07-18:02-04-43,MIT,"Details Go project conventions with comprehensive error handling recommendations, table-driven testing approach guidelines, and modernization suggestions for latest Go features."
claude-14f59511,Basic Memory,CLAUDE.md Files,Project Scaffolding & MCP,https://github.com/basicmachines-co/basic-memory/blob/main/CLAUDE.md,,basicmachines-co,https://github.com/basicmachines-co,TRUE,2025-06-21:13-12-23,2025-07-18:02-04-44,AGPL-3.0,Presents an innovative AI-human collaboration framework with Model Context Protocol for bidirectional LLM-markdown communication and flexible knowledge structure for complex projects.
claude-65aa541a,claude-code-mcp-enhanced,CLAUDE.md Files,Project Scaffolding & MCP,https://github.com/grahama1970/claude-code-mcp-enhanced/blob/main/CLAUDE.md,,grahama1970,https://github.com/grahama1970,TRUE,2025-05-16:14-52-36,2025-07-18:02-04-45,MIT,"Provides detailed and emphatic instructions for Claude to follow as a coding agent, with testing guidance, code examples, and compliance checks."
claude-36517eea,MCP Engine,CLAUDE.md Files,Project Scaffolding & MCP,https://github.com/featureform/mcp-engine/blob/main/CLAUDE.md,,featureform,https://github.com/featureform,FALSE,,2025-07-18:02-04-45,Apache-2.0,"Enforces strict package management with comprehensive type checking rules, explicit PR description guidelines, and systematic approach to resolving CI failures."
claude-4a53c9e8,Perplexity MCP,CLAUDE.md Files,Project Scaffolding & MCP,https://github.com/Family-IT-Guy/perplexity-mcp/blob/main/CLAUDE.md,,Family-IT-Guy,https://github.com/Family-IT-Guy,TRUE,2025-03-20:04-04-46,2025-07-18:02-04-46,ISC,"Offers clear step-by-step installation instructions with multiple configuration options, detailed troubleshooting guidance, and concise architecture overview of the MCP protocol."
doc-93f22142,Anthropic Documentation,Official Documentation,,https://docs.anthropic.com/en/docs/claude-code,,Anthropic,https://github.com/anthropics,TRUE,,2025-07-18:02-04-47,&copy;,"The official documentation for Claude Code, including installation instructions, usage guidelines, API references, tutorials, examples, loads of information that I won't list individually. Like Claude Code, the documentation is frequently updated."
doc-b71240b4,Anthropic Quickstarts,Official Documentation,,https://github.com/anthropics/anthropic-quickstarts/blob/main/CLAUDE.md,,Anthropic,https://github.com/anthropics,TRUE,2025-02-24:19-02-28,2025-07-18:02-04-48,MIT,"Offers comprehensive development guides for three distinct AI-powered demo projects with standardized workflows, strict code style guidelines, and containerization instructions."
